fo 881/1476			TURKEY: O. in C. Danube Navigation 	April 9, 1866	18660409	18660409			O	N	30	4533237	6
fo 881/1477			DENMARK: Corres. Coolie Emigration from India to St. Croix. (I.O.). Missing at transfer 	1865	18650101	18651231			O	N	30	4527328	6
fo 881/1478			BRAZIL: Decree. Opening of the Rivers Amazonas, Tocantino, and San Francisco to Foreign Navigation. (L.G., Jan. 4, 1867). Bound: Brazil 4. Missing at transfer  	Jan. 4, 1867.	18670104	18670104			O	N	30	4526060	6
fo 881/1478X			FRANCE: Decree. Suppression of Tonnage Dues in French Ports. (L.G., Jan. 4, 1867). Missing at transfer 	1867	18670101	18671231			O	N	30	4528124	6
fo 881/1479			NETHERLANDS: Treaties, &amp;c. Dutch and Native Princes in Eastern Seas 	1857-1864	18570101	18641231		Bound: Netherlands 1. Copy.	O	N	30	4531162	6
fo 881/1480			"CHILE &amp; SPAIN: Corres. Detention of ""Cyclone"" and ""Tornado"" by British Customs Authorities "	Mar to Aug 1866	18660301	18660831		Bound: Chile 6. Bound: Spain 7.	O	N	30	4526202	6
fo 881/1481			AUSTRIA-HUNGARY: Corres. Resumption of Sittings of Commercial Mixed Commission 	Oct. 1866 to Jan. 1867	18661001	18670131		Bound: Austria 9.	O	N	30	4525690	6
fo 881/1482			FRANCE: Corres. Operation of French and Brazilian Navigation Laws on British Shipping 	1866-1867	18660101	18671231		Bound: France 7.	O	N	30	4528125	6
fo 881/1483			VENEZUELA: Memo. British Claims on Venezuela. (Mr. F. Irving) 	Feb. 2, 1867	18670202	18670202		Bound: Mema.	O	N	30	4535154	6
fo 881/1484			CHINA: Report. Manufacture of Chinese Grass. (Mr. McClintock). Missing at transfer 	Dec. 15, 1865	18651215	18651215			O	N	30	4526350	6
fo 881/1485			COLOMBIA &amp; MADAGASCAR: O. in C. Seamen Deserters. (L.G., Jan. 1, 1867) 	Dec. 28, 1866	18661228	18661228			O	N	30	7814474	6
fo 881/1486			JAPAN: Desps. Corres. Affairs in Japan 	1864	18640101	18641231		Bound: Japan 1.	O	N	30	4530588	6
fo 881/1487			TURKEY: Corres. Affairs of Danubian Principalities. Danube Navigation. Part 2 	July 1866 to Jan. 1867	18660701	18670131		Bound: Turkey 22.	O	N	30	4533240	6
fo 881/1488			URUGUAY: Further Corres. Hostilities in the River Plate, &amp;c. 	Feb. 1866 to Jan. 1867	18660201	18670131		Bound: Argentine 6.	O	N	30	4535125	6
fo 881/1489			GENERAL: Reports. Law Officers. Bound: L.O.R. Missing at transfer 	1865	18650101	18651231			O	N	30	4528803	6
fo 881/1490			"SPAIN: Corres. Seizure of ""Tornado"" off Madeira by Spanish Frigate ""Gerona."" Part 1 "	Aug. 1866 to Feb. 1867	18660801	18670228		Bound: Spain 7.	O	N	30	4532750	6
fo 881/1491			FRANCE: Corres. Extradition of M. Lamirande from Canada 	1866-1867	18660101	18671231		Bound: France 41.	O	N	30	4528126	6
fo 881/1492			ABYSSINIA: Letter. Expedition to Abyssinia. (General Coghlan) 	Mar. 20, 1867	18670320	18670320		Bound: Abyssinia 4.	O	N	30	4524135	6
fo 881/1493			ABYSSINIA: Desp. Letter from Lt.-Col. Merewether. Military Expedition, and Corres. with King Theodore. (Col. Stanton) 	Mar. 1, 1867	18670301	18670301		Bound: Abyssinia 4.	O	N	30	4524132	6
fo 881/1494			RUSSIA: Letters 2 and 3. Circassia. (General Fadeyeff) 	1866 Jan	18660101	18660131		Bound: Russia 23.	O	N	30	4532259	6
fo 881/1495			"UNITED STATES: Memo. Proposed answer to United States. ""Alabama,"" &amp;c. (Mr. W. E. Gladstone) "	Nov. 27, 1865	18651127	18651127		Bound: Mema.	O	N	30	4534624	6
fo 881/1496			"UNITED STATES: Memo. Proposed answer to United States. ""Alabama,"" &amp;c. (Earl Russell) "	Nov. 30, 1865	18651130	18651130			O	N	30	4534625	6
fo 881/1497			"UNITED STATES: Draft. Despatch to Sir F. Bruce. ""Alabama"" "	Nov. 1865	18651101	18651130		Bound: America 54.	O	N	30	4534622	6
fo 881/1498			"UNITED STATES: Corres. Arrival of ""Shenandoah"" at Liverpool "	1865	18650101	18651231		Bound: America 54.	O	N	30	4534623	6
fo 881/1499			TURKEY: Corres. Disturbances in Crete. 	1866 to Feb. 1867	18660101	18670228		Bound: Turkey 24. See No. 1581	O	N	30	4533246	6
fo 881/1500			SERVIA: Corres. Affairs of Servia 	1866-1867	18660101	18671231		Bound: Turkey 23.	O	N	30	4532521	6
fo 881/1501			"SPAIN: Further Corres. Seizure of ""Tornado"" off Madeira by Spanish Frigate ""Gerona."" Part 2 "	Feb. and Mar. 1867	18670201	18670331		Bound: Spain 7.	O	N	30	4532751	6
fo 881/1502			"SPAIN: Corres. ""Queen Victoria,"" captured by Spanish Revenue Cruiser ""Toro."" Part 1 "	1866-1867	18660101	18671231		Bound: Spain 7.	O	N	30	4532747	6
fo 881/1503			"SPAIN: Further Corres. Seizure of""Tornado"" off Madeira by Spanish Frigate""Gerona."" Part 5. Bound: Spain 7. Missing at transfer "	Mar. 1867	18670301	18670331			O	N	30	4532752	6
fo 881/1503Z			"SPAIN: Further Corres. Seizure of ""Tornado"" off Madeira by Spanish Frigate ""Gerona."" Part 7 "	Jan. to April 1867	18670101	18670430		Bound: Spain 7.	O	N	30	4532753	6
fo 881/1504			UNITED STATES: Corres. Settlement of Claims against Great Britain arising out of Civil War in United States 	1866-1867	18660101	18671231		Bound: America 14.	O	N	30	4534640	6
fo 881/1505			CHINA: Desp. Aggressive Policy of French. Corres. between French Ambassador and Prince Kung. Murder of Roman Catholic Missionaries in Corea. Memo. of Voyage in North China, by Messrs. Williamson and Lees, Protestant Missionaries. (Sir R. Alcock) 	Dec. 13, 1866	18661213	18661213		Bound: China 47.	O	N	30	4526355	6
fo 881/1506			CHINA: Desp. French Policy in China. (Sir R. Alcock) 	Dec. 19, 1866	18661219	18661219		Bound: China 47.	O	N	30	4526356	6
fo 881/1507			ABYSSINIA: Desp. Letter from Col. Merewether. Abyssinian Prisoners. (Col. Stanton) 	Mar. 15, 1867	18670315	18670315		Bound: Abyssinia 4.	O	N	30	4524134	6
fo 881/1508			"UNITED STATES: Memo. United States' ""Alabama"" Claims. Appendix. (Mr. C. S. A. Abbott) "	Feb. 17, 1867	18670217	18670217		Bound: Mema.	O	N	30	4534641	6
fo 881/1509			SERVIA: Corres. Condition of Jews in Servia 	1861-1867	18610101	18671231		Bound: Turkey 23.	O	N	30	4532522	6
fo 881/1510			NETHERLANDS: Memo. Luxemburg. (Mr. E. Hertslet) 	Aug. 16, 1867	18670816	18670816		Bound: Mema.	O	N	30	4531169	6
fo 881/1511			FRANCE: Memo. Demolition of Dunkirk. (Mr. Lewis Hertslet) 	Jan. 20, 1855	18550120	18550120		Bound: Mema.	O	N	30	4528069	6
fo 881/1512			BELGIUM: Memo. Demolition of Antwerp. (Mr. Lewis Hertslet) 	Jan. 20, 1855	18550120	18550120		Bound: Mema.	O	N	30	4525805	6
fo 881/1513			ABYSSINIA: Further Corres. British Captives 	1865-1867	18650101	18671231		Bound: Abyssinia 6.	O	N	30	4524136	6
fo 881/1514			NETHERLANDS: Report. Proposed Barrage of East and Sloe Channels of Scheldt. (Sir C. Hartley) 	April 5, 1867	18670405	18670405		Bound: Netherlands 9.	O	N	30	4531168	6
fo 881/1515			RUSSIA &amp; TURKEY: Desp. Prince Gortchakoff to Baron Brunnow. Proposed Reforms in Administration of Turkish Empire 	27 March 1867	18670327	18670327		Bound: Turkey 70.	O	N	30	4532263	6
fo 881/1516			MOROCCO: O. in C. Consular Jurisdiction 	Aug. 27, 1857	18570827	18570827			O	N	30	4530952	6
fo 881/1517			GENERAL: Memo. Demolition of Fortifications of Huningen, Military Maritime Arsenals in Black Sea, Neutrality of Switzerland, Cracow, and Belgium 	April 24, 1867	18670424	18670424		Bound: Mema.	O	N	30	4528811	6
fo 881/1518			AFRICA: Report. Proceedings of Squadron on West Coast. (Commodore Edmonstone) 	1861	18610101	18611231		Bound: Africa 31.	O	N	30	4524218	6
fo 881/1519			TURKEY: Reports. Consuls in Turkey. Treatment of Christians. Bound: Turkey 70. Missing at transfer 	1867	18670101	18671231			O	N	30	4533251	6
fo 881/1520			GENERAL: Reports. Trade Unions, &#38;c., abroad. Bound: General 55. Missing at transfer 	1867	18670101	18671231			O	N	30	4528812	6
fo 881/1521			"SPAIN: Memo. Character and object of""Tornado"". Bound: Mema. Missing at transfer "	1867	18670101	18671231			O	N	30	4532759	6
fo 881/1522			ABYSSINIA: Letter. Notes, &amp;c., by Mr. W. Munzinger, to accompany Survey. Maps of Roads. (Col. Merewether) 	Feb. 28, 1867	18670228	18670228		Bound: Abyssinia 4.	O	N	30	4524131	6
fo 881/1522X			GENERAL: Memo., &#38;c. Neutrality Laws Commission. Missing at transfer 	1867	18670101	18671231		Bound: General 61.	O	N	30	4528807	6
fo 881/1523			NETHERLANDS: Treaties, &amp;c. Dutch and Native Princes in Eastern Seas 	1865-1866	18650101	18661231		Bound: Netherlands 1. Copy.	O	N	30	4531163	6
fo 881/1524			MOSQUITO: Memo. Claim of Mr. G. R. Brown. Mosquito Land Grants. (Mr. E. Hertslet) 	April 14, 1866	18660414	18660414		Bound: Mema.	O	N	30	4531080	6
fo 881/1525			GENERAL: Memo. Withdrawal of British Ministers from Foreign Courts. (Mr. E. Hertslet) 	Feb. 16, 1867	18670216	18670216		Bound: Mema.	O	N	30	4528810	6
fo 881/1526			TUNIS: Memo. Commercial Relations. (Mr. E. Hertslet) 	Feb. 25, 1867	18670225	18670225		Bound: Mema.	O	N	30	4533017	6
fo 881/1527			BELGIUM &amp; NETHERLANDS: Report. Barrage of Western Scheldt. (M. Gosselin, French Engineer) 	Feb 22 1867	18670222	18670222		Bound: Belgium 3.	O	N	30	4525818	6
fo 881/1528			PORTUGAL &amp; SPAIN: Papers. Claims against Spain and Portugal arising out of Peninsula War 	1864	18640101	18641231		Bound: Spain 24.	O	N	30	4531924	6
fo 881/1529			FRANCE: Papers. Prolongation of Extradition Treaty of 1843 	1866-1867	18660101	18671231		Bound: France 7.	O	N	30	4528123	6
fo 881/1530			TURKEY: Memo. Application to Principalities of Wallachia and Moldavia, of Treaties existing between Turkey and Foreign Powers. 1393-1866. (Mr. A. S. Green) 	June 12, 1867	18670612	18670612		Bound: Mema.	O	N	30	4533236	6
fo 881/1531			MADAGASCAR: O. in C. Consular Jurisdiction. (L.G., May 21, 1867) 	May 17, 1867	18670517	18670517			O	N	30	4530844	6
fo 881/1532			"SPAIN: Further Corres. Seizure of ""Tornado"" off Madeira by Spanish Frigate ""Gerona."" Part 8 "	April to June 1867	18670401	18670630		Bound: Spain 7.	O	N	30	4532754	6
fo 881/1533			"SPAIN: Further Corres. Seizure of ""Tornado"" off Madeira by Spanish Frigate ""Gerona."" Part 9 "	June 1867	18670601	18670630		Bound: Spain	O	N	30	4532755	6
fo 881/1534			TURKEY: Corres. Treatment of Jews in Roumania 	1867	18670101	18671231		Bound: Turkey 70. Copy.	O	N	30	4533248	6
fo 881/1535			NETHERLANDS: Corres. Proposed Cession of Luxemburg to France 	1867	18670101	18671231		Bound: France 12.	O	N	30	4531170	6
fo 881/1536			"SPAIN: Corres. British Schooner ""Mermaid"" sunk by Shot fired from Spanish Fort at Ceuta "	1864-1867	18640101	18671231		Bound: Spain 7	O	N	30	4532758	6
fo 881/1537			CHINA: Further Corres. Rendition of a Chinese Criminal at Hong Kong. Torture. Missing at transfer  	Mar. 1865 to Feb. 1866	18650301	18660228			O	N	30	4526354	6
fo 881/1538			ABYSSINIA: Suggestions. Advance into Abyssinia. (Sir S. Baker). Bound: Abyssinia 4. Missing at transfer  	July 13, 1867	18670713	18670713			O	N	30	4524138	6
fo 881/1539			VENEZUELA: Memo respecting British claims on Venezuela. Missing at transfer 	2 Feb 1867	18670202	18670202			O	N	30	7814111	6
fo 881/1540			VENEZUELA: Report of Law Officers on British claims on Venezuela. Missing at transfer 	16 July 1867	18670716	18670716		Kept with waste of LO Reports	O	N	30	7814116	6
fo 881/1541			UNITED STATES: Memo. Claim of United States' Government under 3rd Article of Treaty of Washington of Aug. 9, 1842, to Exemption from Export Duty of Timber cut in State of Maine, and floated down River St. John. (Mr.A. S. Green) 	July 30, 1867	18670730	18670730		Bound: Mema.	O	N	30	4534643	6
fo 881/1542			DENMARK: Memo. Commercial and Political Importance of Iceland. (Mr. F. Irving) 	June 25, 1865	18650625	18650625		Bound: Mema.	O	N	30	4527329	6
fo 881/1543			ABYSSINIA: Further Corres. British Captives 	Mar. to July, 1867	18670101	18671231		Bound: Abyssinia 4.	O	N	30	4524139	6
fo 881/1544			ARGENTINE REPUBLIC: Corres. Establishment of Welsh Colony at Chupat 	1865-1867	18650101	18671231		Bound: Argentine 2.	O	N	30	4525383	6
fo 881/1545			GREECE: Memo. Policy of Great Britain during Greek Insurrection in 1821-26, with regard to Greek Cruisers fitted out by Provisional Government. Alleged Intention of Provisional Government of Crete to issue Letters of Marque. (Mr. A. S. Green) 	Aug. 31, 1867	18670831	18670831		Bound: Mema.	O	N	30	4530193	6
fo 881/1546			BRAZIL: Decree. Customs and Police. Regulations on opening the River Amazon to Foreign Shipping. (L.G., Sept. 10, 1867) 	Sept. 10, 1867	18670910	18670910		Bound: Brazil 4.	O	N	30	4526061	6
fo 881/1547			GENERAL: O. in C. Cattle Plague. Scotland. (L.G., Sept. 13, 1867) 	1867	18670101	18671231			O	N	30	4528813	6
fo 881/1548			TURKEY: Desp. and Proposed Draft Act. Navigation and Police of the Danube, with Memorandum of Major Stokes 	Mar. 28, 1867	18670328	18670328		Bound: Turkey 23.	O	N	30	4533247	6
fo 881/1549			FRANCE &amp; ITALY: Convention. France and Italy. Evacuation of Papal States 	Sept 15 1864	18640915	18640915		Bound: Rome 4.	O	N	30	4528116	6
fo 881/1550			TURKEY: Reports. Condition of Crete 	1858-1862	18580101	18621231		Bound: Turkey 22.	O	N	30	4533213	6
fo 881/1551			EGYPT: Corres. and Firman. Succession to the Vice-Royalty of Egypt 	1866	18660101	18661231		Bound: Egypt 36.	O	N	30	4527405	6
fo 881/1552			FRANCE &amp; UNITED STATES: Corres. Fitting Out of Privateers in American Ports during war with Great Britain. Correspondence of Mr Hammond. 	1793	17930101	17931231		Bound: America 49. 29 pp.	O	N	30	4528022	6
fo 881/1552X			DENMARK: Articles of agreement for marriage of Princess Helena with Prince Christian of Schleswig-Holstein. Missing at transfer  	2 July 1866	18660702	18660702			O	N	30	7817779	6
fo 881/1553			AUSTRIA-HUNGARY: Further Corres. Resumption of Sittings of Anglo-Austrian Mixed Commission 	Jan. to May 1867	18670101	18670531		Bound: Austria 9.	O	N	30	4525692	6
fo 881/1554			AUSTRIA-HUNGARY: Corres. Proceedings of Anglo-Austrian Tariff Commission 	May to Sept. 1867	18670501	18670930		Bound: Austria 9.	O	N	30	4525693	6
fo 881/1555			EGYPT: Desp. To Col. Stanton. Judicial Reforms 	Oct. 18, 1867	18671018	18671018		Bound: Egypt 7.	O	N	30	4527406	6
fo 881/1556			POLAND &#38; RUSSIA: Desp. Frauds on British Manufacturers in Poland. (Col. Mansfield). Missing at transfer 	Sept. 3, 1867	18670903	18670903			O	N	30	4531883	6
fo 881/1557			RUSSIA: Letters. Memo. on Russian Tariff. Replies of Chambers of Commerce 	1867 Sept	18670901	18670930		Bound: Russia 7.	O	N	30	4532264	6
fo 881/1558			MUSCAT: O. in C. Consular Jurisdiction. (L.G., Nov. 5, 1867) 	Nov. 4, 1867	18671104	18671104			O	N	30	4531117	6
fo 881/1559			ABYSSINIA: Memo. Abyssinia. (Mr. C. S. A. Abbott) 	Nov. 16, 1867	18671116	18671116		Bound: Mema.	O	N	30	4524140	6
fo 881/1560			RUSSIA: Papers (3). Memo. on Tariff Reform in Russia. Memo. on Russian Tariff. (M. de Reutern.) 	1867	18670101	18671231		Bound: Russia 7. See No. 1557	O	N	30	4532266	6
fo 881/1561			PORTUGAL: Further Corres. Royal Union Mercantile Company. Claims of British Subjects. 	Aug. 1864 to July 1867	18640801	18670731		Bound: Portugal 3. See Parliamentary No. 897 for previous Corres.	O	N	30	4531927	6
fo 881/1562			CHINA: Correspondence respecting engagement of Chinese migrants by British and French subjects. Proposed international regulations, and convention with China. 	Mar-Dec 1864	18640301	18641231		59 pp.	O	N	30	7808655	6
fo 881/1563			FRANCE: Corres. Proposed Conference on the Affairs of Rome. Missing at transfer 	Nov. 1867	18671101	18671130			O	N	30	4528127	6
fo 881/1564			PORTUGAL: Corres. Commercial Relations between Great Britain and Portugal. Part 1 	1866-1867	18660101	18671231		Bound: Portugal 3.	O	N	30	4531928	6
fo 881/1565			PORTUGAL: Corres. Commercial Relations between Great Britain and Portugal. Part 2 	1868	18680101	18681231		Bound: Portugal 3.	O	N	30	4531929	6
fo 881/1566			TURKEY: Letter. Euphrates Valley Railway. (Mr. W. P. Andrew) 	Dec 18, 1867	18671218	18671218		Bound: Turkey 23. 	O	N	30	4533250	6
fo 881/1567			RUSSIA: Report. Cloth and Woollen Manufacture. (Mr. T. Michell) 	1867	18670101	18671231		Bound: Russia 7.	O	N	30	4532267	6
fo 881/1568			RUSSIA: Papers. Trade of Russia, &amp;c. With Appendix. 1. Free Trade and Protection. 2. Memo. Treaty. Zollverein and Russia. 3. German Chambers of Commerce. (Mr. T. Michell) 	1865	18650101	18651231		Bound: Russia 7.	O	N	30	4532258	6
fo 881/1569			CHINA: Treaties. Great Britain, France, United States, and Russia 	1858	18580101	18581231		Bound: China 57.	O	N	30	4526289	6
fo 881/1570			UNITED STATES: Corres. Termination of Reciprocity Treaty of June 5, 1854 	1865-1866	18650101	18661231		Bound: America 40. Copy.	O	N	30	4534636	6
fo 881/1570X			UNITED STATES: Further Corres. Termination of Reciprocity Treaty of June 5, 1854. Bound: America 40. Missing at transfer 	June 1866	18660601	18660630			O	N	30	4534637	6
fo 881/1571			CHINA: General Regulations for the establishment of the superintendency and consulates in China. Missing at transfer. See FO 881/1735, 1926 &#38; 2199 	1 Nov 1862 (Revised Feb 1868)	18620101	18681231			O	N	30	7814117	6
fo 881/1572			CHINA: Return (H. of C.). Lands conceded to British Subjects in China and Japan, &#38;c. Missing at transfer  	1864	18640101	18641231			O	N	30	4526347	6
fo 881/1573			GREECE: Corres. Woodhouse Collection. Charges brought against Consul-General Saunders 	1866-1867	18660101	18671231			O	N	30	4530194	6
fo 881/1574			GENERAL: Draft. Bill to amend Foreign Enlistment Act 	Nov. 25, 1865	18651125	18651125		Bound: General 55.	O	N	30	4528800	6
fo 881/1575			TURKEY: Returns. Consuls in the Levant, on the British Consular Service 	1856-1857	18560101	18571231		Bound: General 9.	O	N	30	4533156	6
fo 881/1576			PRUSSIA: Reports. British Consular Establishment at Prussian Baltic Ports. Bound: Germany 7. Missing at transfer 	1856	18560101	18561231			O	N	30	4532134	6
fo 881/1577			JAPAN: Memo. Proposed Establishment of a College in Japan. Missing at transfer  	Sept. 1867	18670901	18670930			O	N	30	4530600	6
fo 881/1578			GENERAL: Replies. Differential Shipping Dues 	1860	18600101	18601231		Bound: General 55.	O	N	30	4528758	6
fo 881/1579			JAPAN: Notice. Opening of Yedo (Tokio) and Niigata to Foreign Trade, and arrangements for the Settlement of Foreigners. (L.G., Feb. 25, 1868) 	Nov. 26, 1867	18671126	18671126			O	N	30	4530601	6
fo 881/1580			URUGUAY: Corres. Hostilities in the River Plate, &amp;c. 	May 1867 to Jan. 1868	18670501	18680131		Bound: Argentine 6.	O	N	30	4535126	6
fo 881/1581			RUSSIA &amp; TURKEY: Corres. Eastern Question. (Continuation of No. 1499) 	Dec 1866 to Nov 1867	18661201	18671130		Bound: Turkey 24.	O	N	30	4532265	6
fo 881/1581A			TURKEY: Corres. Eastern Question. (Continuation of No. 1499). Correspondence rtespecting the disturbances in Crete. 	1866 to Nov 1867	18660101	18671130		Bound: Turkey 24.	O	N	30	4533249	6
fo 881/1582			"SPAIN: Further Corres. Seizure of ""Tornado"" off Madeira by Spanish Frigate ""Gerona."" Part 10 "	June 1867 to Feb. 1868	18670601	18680228		Bound: Spain	O	N	30	4532756	6
fo 881/1583			CHILE &amp; SPAIN: Further Corres. War. Spain and Chile 	April 1866 to Feb 1867	18660401	18670228		Bound: Spain 6.	O	N	30	4526203	6
fo 881/1584			GENERAL: Memo. Naturalization and Allegiance. (Mr. C. S. A. Abbott) 	Mar. 19, 1868	18680319	18680319		Bound: Mema.	O	N	30	4528819	6
fo 881/1585			ABYSSINIA: Corres. Abyssinia. Establishment of a Consulate at Massowah, &amp;c. Part 1 	1846-1863	18460101	18631231		Bound: Abyssinia 1.	O	N	30	4524120	6
fo 881/1586			ABYSSINIA: Corres. Abyssinia. Discovery of Coal Fields, 1863-67. Part 2 	1864-1868	18640101	18681231		Bound: Abyssinia 2.	O	N	30	4524141	6
fo 881/1587			RUSSIA: Memo. Circumstances which led to conclusion of Convention with Russia of 1825. Trade in Pacific, and Limits of Possessions on N.W. Coast of America. Appendix A.-Convention. Russia and United States. April 5, 1824. Appendix B.-Convention. Russiaand Great Britain. Feb. 28, 1825. (Mr. Lewis Hertslet) 	July 1835	18350701	18350731		Bound: Mema.	O	N	30	4532200	6
fo 881/1588			JAPAN: O. in C. Neutrality during Civil War. (L.G., May 15, 1868) 	May 14, 1868	18680514	18680514		Bound: Japan 2.	O	N	30	4530603	6
fo 881/1589			TURKEY: Corres. Disturbances in Crete. (Continuation of No. 1581) 	Oct. 1867 to April 1868	18671001	18680430		Bound: Turkey 24.	O	N	30	4533253	6
fo 881/1590			PACIFIC ISLANDS: Corres. Slave Trade in New Hebrides 	June 24, 1868	18680624	18680624		Bound: Pacific 13.	O	N	30	4531332	6
fo 881/1591			URUGUAY: Corres. Hostilities in the River Plate, &amp;c. 	Mar. to July 1868	18680301	18680731		Bound: Argentine 6.	O	N	30	4535127	6
fo 881/1592			TURKEY: Report. Provinces of Trebizond, Sivas, Kastemouni, and part of Angora. (Consul W. G. Palgrave) 	Jan 1868	18680101	18680131		Bound: Turkey 70. 73 pp & 2 maps.  	O	N	30	4533252	6
fo 881/1593			SPAIN: Memo. Rights and Privileges of British Subjects under Ancient Treaties. (Mr. E. Hertslet) 	1868 Oct 15	18681015	18681015		Bound: Mema.	O	N	30	4532760	6
fo 881/1594			SPAIN: Memo. Application of Treaties to Spanish Colonies. (Mr. A. S. Green) 	1868 Jan 11	18680111	18680111		Bound: Mema.	O	N	30	4532762	6
fo 881/1595			SPAIN: Memo. and Minutes. Trial of British Subjects. Fuero de Estrangeria. (Mr. Lewis Hertslet, &amp;c.) 	1855-1856	18550101	18561231		Bound: Mema.	O	N	30	4532763	6
fo 881/1596			BELGIUM GREAT BRITAIN FRANCE NETHERLANDS: Corres. Drawbacks on Sugar. Convention of Nov. 8, 1864 	1865-1868	18650101	18681231		Bound: General 13.	O	N	30	4525819	6
fo 881/1597			GENERAL: Reports. Law Officers 	1866	18660101	18661231		Bound: L.O.R.	O	N	30	4528808	6
fo 881/1598			ABYSSINIA: Further Corres. Affairs of Abyssinia. Part 3 	1867-1868	18670101	18681231		Bound: Abyssinia 3.	O	N	30	4524142	6
fo 881/1598X			ABYSSINIA: Papers. Abyssinian Expedition. (I.O). Missing at transfer 	1867-1868	18670101	18681231		Bound: Abyssinia 11	O	N	30	4524143	6
fo 881/1599			ABYSSINIA: Index. To Corres. (See Nos. 1585, 1586, 1598.) (Mr. E. Hertslet) 	1848-1868	18480101	18681231		Bound: Abyssinia 3.	O	N	30	4524145	6
fo 881/1599X			ABYSSINIA: Desp. General Napier's Military Proceedings. (L.G., June 16, 1868). Missing at transfer 	1868	18680101	18681231		Bound: Abyssinia 6	O	N	30	4524144	6
fo 881/1600			ABYSSINIA: Letter. Routes into Abyssinia. (Dr. Beke) 	April 12, 1867	18670412	18670412		Bound: Abyssinia 4.	O	N	30	4524137	6
fo 881/1601			ABYSSINIA: Desp. Expedition against Abyssinia. (Col. W. L. Merewether to Lord Stanley) 	Mar. 4, 1867	18670304	18670304		Bound: Abyssinia 4.	O	N	30	4524133	6
fo 881/1602			RUSSIA: Report on certain proceedings at the Brirish Consulate at Odessa (case of Mr Murray) 	18 Dec 1867	18671218	18671218		15 pp	O	N	30	7814112	6
fo 881/1603			GENERAL &amp; UNITED STATES: Report, &amp;c. Consular Conventions. Conventions between various Foreign Powers. (Mr. F. S. Reilly) 	Oct 16 1868	18681016	18681016		Bound: General 12.	O	N	30	4528818	6
fo 881/1604			JAPAN: Desp. Revision of Duties on Silk and Tea. (Sir H. Parkes) 	Sept. 12, 1868	18680912	18680912		Bound: Japan 3.	O	N	30	4530604	6
fo 881/1605			GENERAL: Memo. Extradition. Missing at transfer 	1868	18680101	18681231			O	N	30	4528820	6
fo 881/1606			FRANCE: Memo. Progress of French Industries since conclusion of Treaty of Commerce in 1860. (W. M. B.) 	April 1866	18660401	18660430		Bound: Mema.	O	N	30	4528114	6
fo 881/1607			GENERAL: Memo. British Commerce, Navigation, and Finance, before and since the adoption of Free Trade and Repeal of the Navigation Laws. (B. of T.) 	June 28, 1866	18660628	18660628			O	N	30	4528805	6
fo 881/1608			UNITED STATES: Report from Law Officers on claims arising out of Civil War. Missing at transfer 	Feb 14 1867	18670214	18670214			O	N	30	7814118	6
fo 881/1609			ABYSSINIA: Report. Mission to Abyssinia. (Mr. H. Rassam) 	Sept. 1, 1868	18680901	18680901		Bound: Abyssinia 2.	O	N	30	4524146	6
fo 881/1610			ABYSSINIA: Report. Proceedings in Abyssinia. (Consul C. D. Cameron) 	Sept. 28, 1868	18680928	18680928		Bound: Abyssinia 2.	O	N	30	4524147	6
fo 881/1611			BELGIUM: Returns. Belgian Commerce 	1859-1864	18590101	18641231		Bound: Belgium 3.	O	N	30	4525816	6
fo 881/1612			GENERAL: Corres. Mr. Philip Griffith's Pension. Bound: General 55. Missing at transfer 	1862-1867	18620101	18671231			O	N	30	4528809	6
fo 881/1613			GENERAL: Memo. Foreign Office Agencies 	Jan. 1868	18680101	18680131		Bound: General 4.	O	N	30	4528815	6
fo 881/1614			GREECE: Drafts of Treaty. Ionian Islands 	1863	18630101	18631231		Bound: Ionian Isds. 2.	O	N	30	4530188	6
fo 881/1614X			GREECE: Projet of Treaty. Ionian Islands 	Mar. 3, 1864	18640303	18640303			O	N	30	4530189	6
fo 881/1615			NETHERLANDS: Opinion. Damming-up Eastern Scheldt. Navigation of Antwerp. (M. Hagen) 	Mar. 29, 1867	18670329	18670329		Copy.	O	N	30	4531167	6
fo 881/1616			NETHERLANDS: Corres. Policy of Netherland Government in Eastern Seas, Java, Sumatra, &amp;c. Memo., Aug. 24, 1864. (Mr. A. S. Green) 	1824-1867	18240101	18671231			O	N	30	4531165	6
fo 881/1617			RUSSIA: Analysis. Proposed Alterations in Russian Tariff 	1867	18670101	18671231		Bound: Russia 7.	O	N	30	4532268	6
fo 881/1618			"SPAIN: Further Paper.""Queen Victoria,"" captured by Spanish Revenue Cruiser""Toro."" Part 2. Missing at transfer "	1867 April 9	18670409	18670409			O	N	30	4532748	6
fo 881/1619			TURKEY: Memo. France. Reforms in Turkey 	Feb. 1867	18670201	18670228		Bound: Turkey 23.	O	N	30	4533245	6
fo 881/1620			"UNITED STATES: Memo.""Alabama,"" and other Claims. (Mr. C. S. A. Abbott). Missing at transfer "	Oct. 6, 1866	18661006	18661006			O	N	30	4534639	6
fo 881/1621			GENERAL: Proposed treaty on naturalisation. Missing at transfer 	June 1868	18680601	18680630			O	N	30	7814119	6
fo 881/1622			GENERAL: Memo. Proposed Changes in Consular Service. Estimate 1869-1870. Missing at transfer 	1869-1870	18690101	18701231			O	N	30	4528841	6
fo 881/1623			CHINA: Corres. Attack on British Protestant Missionaries at Yangchow. Bound: China 5. Missing at transfer 	1868-1869	18680101	18691231			O	N	30	4526365	6
fo 881/1624			MADAGASCAR: O. in C. Consular Jurisdiction 	Feb. 4, 1869	18690204	18690204			O	N	30	4530846	6
fo 881/1625			SPAIN: O. in C. Seaman Deserters 	Jan. 23, 1860.	18600123	18600123			O	N	30	4532738	6
