fo 881/2919			GENERAL: Memo. Consular Chaplains. (Mr. E. Hertslet) 	June 22, 1874	18740622	18740622		Bound: Mema.	O	N	30	4528971	6
fo 881/2920			PACIFIC ISLANDS: Draft. Engagement with Chiefs of Caroline Islands 	Aug. 1876	18760801	18760831		Bound: Pacific 9.	O	N	30	4531349	6
fo 881/2921			PORTUGAL: Memo. West Coast of Africa. Rights to Territories which extend from 5� 12' to 8� S. (Senhor Corvo to the Duke of Saldanha, Dec. 4, 1875) 	Mar. 1876	18760301	18760331		Bound: Portugal 8.	O	N	30	4531954	6
fo 881/2922			GENERAL: Memo. Countries in which Slavery still exists. List of Treaties with African Chiefs. (Mr. E. Hertslet) 	1876	18760101	18761231		Bound: Mema.	O	N	30	4528972	6
fo 881/2923			GENERAL: Memo. Instances of Arbitration. (Mr. E. Hertslet) 	July 1873	18730701	18730731		Bound: Mema.	O	N	30	4528973	6
fo 881/2924			JAPAN: Notes. Foreigners Shooting within Treaty limits 	1876	18760101	18761231		Bound: Japan 6.	O	N	30	4530643	6
fo 881/2925			CHINA: Corres. Attack on Indian Expedition to Western China and Murder of Mr. Margary. Part 4 	Jan. to June 1876	18760101	18760630		Bound: China 11.	O	N	30	4526448	6
fo 881/2926			UNITED STATES: British Case. Fishery Commission under Treaty of Washington 	1871	18710101	18711231		Bound: America 16.	O	N	30	4534784	6
fo 881/2927			TURKEY: Further Corres. Affairs in the Herzegovina. Part 4. Bound: Turkey 35. Missing at transfer 	June 28 to July 1876	0	0			O	N	30	4533311	6
fo 881/2928			AFRICA: Treaties. Congo Chiefs on West Coast of Africa 	1876	18760101	18761231		Bound: Portugal 8.	O	N	30	4524279	6
fo 881/2929			GENERAL: Papers (2). Silver Currency abroad 	1876-1877	18760101	18771231		Bound: General 79. Noted as missing 23/10/84	O	N	30	4528975	6
fo 881/2930			DOMINICAN REPUBLIC: Law. Contraband of War. (L.G., Aug. 22, 1876). Missing at transfer 	Aug 18 1876	18760818	18760818			O	N	30	4527369	6
fo 881/2931			Missing at transfer 	.	0	0			O	N	30	7837215	6
fo 881/2934			CHINA: Diary. Mr. Grosvenor's Mission to Y�nnan 	1875-1876	18750101	18761231		Bound: China 11.	O	N	30	4526449	6
fo 881/2934X			CHINA: Corres. Mr. Grosvenor's Mission to Y�nnan. Bound: China 11. Missing at transfer  	March to June 1876	18760301	18760630			O	N	30	4526450	6
fo 881/2936A			TURKEY: Despatch relating to the atrocities in Bulgaria 	5 Sept 1876	18760905	18760905			O	N	30	7837216	6
fo 881/2936B			TURKEY: Despatch relating to the atrocities in Bulgaria 	5 Sept 1876	18760905	18760905			O	N	30	7837217	6
fo 881/2937			TURKEY: Telegrams. Turkey and Servia. Mediation of European Powers. Bound: Turkey 67. Missing at transfer 	1876	18760101	18761231			O	N	30	4533312	6
fo 881/2940			GENERAL: Further Corres. Sugar Question 	June to Sept. 1876	18760601	18760930		Bound: General 13.	O	N	30	4528965	6
fo 881/2941			UNITED STATES: Corres. Extradition (Sir E. Thornton) 	1876	18760101	18761231		Bound: America 19.	O	N	30	4534781	6
fo 881/2943			TURKEY: Memo. Plague in Mesopotamia. (Dr. J. N. Radcliffe) 	Aug. 1876	18760801	18760831		Bound: Turkey 36.	O	N	30	4533313	6
fo 881/2944			TURKEY: Proposals of the Russian government relating to those parties refusing conditions of peace 	26 Sept 1876	18760926	18760926		1 pp.	O	N	30	7839480	6
fo 881/2946X			RUSSIA &#38; TURKEY: Memo. Probable course of action. Russian Occupation of Bulgaria and March on Constantinople. Map. (W.O). Missing at transfer 	1876 Oct 16	18761016	18761016		Bound: Russia 23 & 33	O	N	30	4532305	6
fo 881/2947			SPAIN: Corres. Right of Great Britain to Claim Most-favoured-Nation Treatment in Spain. Missing at transfer 	1875-1876	18750101	18761231		Bound: Spain 4	O	N	30	4532795	6
fo 881/2948			RUSSIA &amp; TURKEY: Corres. Proposed Basis of Peace between Turkey and Servia and Montenegro. Reforms. Provinces. Bosnia, &amp;c. National Assembly. Armistice 	1876	18760101	18761231		Bound: Turkey 67.	O	N	30	4532304	6
fo 881/2952			UNITED STATES: Further Corres. British North American Fisheries. Halifax Commission, and Reciprocity Treaty between Canada and United States 	1874-1876	18740101	18761231		Bound: America 18.	O	N	30	4534785	6
fo 881/2953			SPAIN: Notice. Passports. (L.G., Sept. 19, 1876) 	Sept. 19, 1876	18760919	18760919			O	N	30	4532796	6
fo 881/2954			GENERAL: Reports. Leprosy in North Italy, Greek Archipelago, Palestine, and parts of Bombay 	1876	18760101	18761231		Bound: Turkey 36.	O	N	30	4528976	6
fo 881/2955			SPAIN: Corres. Murder of Mr. J. F. Robert at San Juan del Puerto 	1871-1876	18710101	18761231		Bound: Spain 9.	O	N	30	4532797	6
fo 881/2956			TURKEY: Report. Vilayet of the Danube. (Sir R. Dalyell) 	Mar. 1, 1869	18690301	18690301		Bound: Turkey 21.	O	N	30	4533315	6
fo 881/2957			AFRICA: Letter. Sir W. Hewett's Proceedings in River Niger 	1876	18760101	18761231		Bound: Portugal 8.	O	N	30	4524280	6
fo 881/2958			RUSSIA &amp; TURKEY: Despatch to Lord A Loftus (No. 554): Record of efforts made by HM's Government for preservation of peace in Eastern Europe. 	30 Oct 1876	18761030	18761030			O	N	30	7839483	6
fo 881/2959			TURKEY: Memo. Instructions to Lord Stratford de Redcliffe and Col. Rose as to sending British Fleet into Dardanelles, Bosphorus, and Black Sea, prior to destruction by Russians of Turkish Fleet at Sinope in 1853. (Mr. E. Hertslet) 	Oct. 28, 1876	18761028	18761028		Bound: Mema.	O	N	30	4533314	6
fo 881/2960			GERMANY &amp; TURKEY: Desp. Prince Bismarck's views respecting settlement of Eastern Question. Austrian Ambassador at St. Petersburg ordered to go to Livadia. (Lord Odo Russell) 	Oct 23 1876	18761023	18761023		Bound: Turkey 67.	O	N	30	4529962	6
fo 881/2961			AUSTRIA-HUNGARY &amp; TURKEY: Corres. Proposed Entente Cordiale between Great Britain and Austria 	1871-1874	18710101	18741231		Bound: Turkey 67.	O	N	30	4525714	6
fo 881/2962			PACIFIC ISLANDS: O. in C. Foreign Deserters. Hawaii. (L.G., Oct. 27, 1876) 	Oct. 23, 1876	18761023	18761023			O	N	30	4531350	6
fo 881/2963			SIAM: O. in C. Foreign Jurisdiction. (L.G., Oct. 27, 1876) 	23 Oct 1876	18761023	18761023			O	N	30	4532553	6
fo 881/2963X			SIAM: Draft. O. in C. Foreign Jurisdiction 	July 1876	18760701	18760731		Bound: Siam 9.	O	N	30	4532552	6
fo 881/2963Z			SIAM: Treaty. India and Siam. Burma, &amp;c. 	14 Jan 1874	18740114	18740114		Bound: Siam 9.	O	N	30	4532554	6
fo 881/2964			TURKEY: Further Corres. Affairs in Turkey. Part 5. Missing at transfer. See FO 881/2927 and FO 424/43 	July-Sept 1876	18760701	18760930		Bound: Turkey 35	O	N	30	4533316	6
fo 881/2965			UNITED STATES: Memo. The Three Rules. (Mr. F. C. Ford) 	Oct. 30, 1876	18761030	18761030		Bound: Mema.	O	N	30	4534786	6
fo 881/2967			EGYPT: Memo. Suez Canal Company. Claim of H.M. Government to be represented and to Vote at General Meetings. (Mr. F. S. Reilly.) 	1876	18760101	18761231		Bound: Mema. See also 8460	O	N	30	4527455	6
fo 881/2968			TURKEY: Further Corres. Affairs in Turkey. Part 6 	1876 Sept 16-Oct 5	18760101	18761231		Bound: Turkey 35.	O	N	30	4533317	6
fo 881/2969			TURKEY: Desp. Christians. Porte's Memo. on Operation of Hatti-Houmayoun. (Sir H. Bulwer) 	1861 Jan 8	18610108	18610108		Bound: Turkey 21.	O	N	30	4533318	6
fo 881/2970			TURKEY: List. Books and Maps 	1822-1876	18220101	18761231		Bound: Turkey 43.	O	N	30	4533319	6
fo 881/2971			TURKEY: List. Confidential Papers 	1874-1876	18740101	18761231		Bound: Turkey 43.	O	N	30	4533320	6
fo 881/2972			TURKEY: List. Parliamentary Papers 	1812-1876	18120101	18761231		Bound: Turkey 43.	O	N	30	4533321	6
fo 881/2973			TURKEY: List. Treaties and Protocols 1774-1860 	1876 Nov 14	18761114	18761114		Bound: Turkey 43.	O	N	30	4533322	6
fo 881/2974			PERSIA &amp; TURKEY: Treaties. Persia and Russia (Turcomantchai). No. 1. Peace and Friendship. No.2 Commerce 	Feb 22 1828	18280222	18280222		Bound: Persia 1.	O	N	30	4531582	6
fo 881/2975			TURKEY: Statement. Consular Posts and Salaries in Turkey in Europe 	1866-1876	18660101	18761231		Bound: Turkey 43.	O	N	30	4533325	6
fo 881/2976			TURKEY: Desp. 1. Reasons of discontent of Christians in Crete; and 2. Report on their uncertain attitude. (Consul T. B. Sandwith) 	Aug. 14, 1876	18760814	18760814		Bound: Turkey 67.	O	N	30	4533323	6
fo 881/2977			TURKEY: Instructions to the Marquis of Salisbury for guidance in conferences on Eastern Question. Missing at transfer  	20 Nov 1876	18761120	18761120			O	N	30	7839495	6
fo 881/2980			TURKEY: Memo. Manner in which the Constantinople Conference will be conducted. (Lord Tenterden) 	Nov. 20, 1876	18761120	18761120		Bound: Mema.	O	N	30	4533324	6
fo 881/2981			FRANCE &amp; TURKEY: Memo. Employment of French Troops in Syria, 1860-1861. (Lord Tenterden) 	Nov 21 1876	18761121	18761121		Bound: Turkey 41.	O	N	30	4528233	6
fo 881/2982			TURKEY: Corres. Proposed Conference. Russian Ultimatum. Czar's denial of intention to possess Constantinople. (L.G., Nov. 21 1876) 	1876 Oct 31-Nov 21	0	0		Bound: Turkey 67.	O	N	30	4533326	6
fo 881/2983			TURKEY: Firmans, Protocols, &amp;c. Lebanon 	1841-1883	18410101	18831231		Bound: Turkey 43.	O	N	30	4533327	6
fo 881/2984			TURKEY: Corres. Murder of French and German Consuls at Salonica 	1876 May-Aug	18760501	18760831		Bound: Turkey 26.	O	N	30	4533328	6
fo 881/2985			GENERAL: List. Consular Jurisdiction Os. in C. 	Dec. 1, 1876	18761201	18761201			O	N	30	4528977	6
fo 881/2986			BRAZIL &amp; PARAGUAY: Treaties. Brazil and Paraguay 	1872	18720101	18721231		Bound: Paraguay 1.	O	N	30	4526066	6
fo 881/2987			TURKEY: Memo. Administrative Reforms in Bosnia, 1850-1876. Extracts of Despatches. (Mr T H Sanderson) 	1876 Nov	18761101	18761130		Bound: Turkey 37.	O	N	30	4533329	6
fo 881/2988			TURKEY: The Marquis of Salisbury to the Earl of Derby. Interview with Prince Bismarck 	1876 Nov 23	18761123	18761123			O	N	30	9199820	6
fo 881/2990			TURKEY: From the Marquis of Salisbury. Interviews with Count Andrassy and the Emperor of Austria. Position of Count Andrassy on the Eastern Question 	Nov 29 & 30 1876	18760101	18761231		2 pp.	O	N	30	7839529	6
fo 881/2991			TURKEY: Declaration. Great Britain and Roumania, Commercial Arrangement. (L.G., Dec. 5, 1876) 	Nov 30 1876	18761130	18761130			O	N	30	4533330	6
fo 881/2992			EGYPT: Proposals submitted to the Khedive by Mr Goschen and M Joubert for the settlemeont of the debts due by Egypt to her foreign bondholders 	Nov 3 1876 	18761103	18761103		8 pp.	O	N	30	7839530	6
fo 881/2993			TURKEY: Eastern question.Telegram from the Marquis of Salisbury. Occupation not a sine qua non. Question of provisional occupation until police is organised. Fear of massacres among Christian minorities.Failure of Russian loan. Peaceful addresses to the Czar. 	Dec 6 1893	18931206	18931206		1 pp.	O	N	30	7839531	6
fo 881/2994			EGYPT: Notes. Financial Condition of Egypt. (Mr. S. Cave) 	Not dated				Bound: Egypt 8.	O	N	30	4527456	6
fo 881/2995			EGYPT: Desp. Decree of Khedive, who accepts Financial Proposals of Messrs. Goschen and Joubert. (Mr. Vivian) 	Nov. 18, 1876	18761118	18761118			O	N	30	4527490	6
fo 881/2996			TURKEY: Turkish position in relation to Bulgaria. Fears of General Ignatiew in relation to possibility of further massacres. 	Dec 11 1876	18761211	18761211		1 pp.	O	N	30	7839533	6
fo 881/2997			TURKEY: Memo. General Ignatiew's Provisional Propositions for Government of Bulgaria. (Lord Tenterden) 	Dec 13 1876	18761213	18761213		Bound: Mema. 1 pp.	O	N	30	4533331	6
fo 881/2998			TURKEY: Scheme of General Ignatiew. Protection of Christians. 	Dec 13 1876	18761213	18761213			O	N	30	7839532	6
fo 881/2999			TURKEY: From Marquiss of Salisbury. Further correspondence relating to Scheme of General Ignatiew. Missing at transfer 	Dec 6-15 1876	18760101	18761231			O	N	30	7839496	6
fo 881/3000			UNITED STATES: US to negociate for a new extradiction treaty with Great Britain 	Dec 13 1876	18761213	18761213		1 pp.	O	N	30	7839534	6
fo 881/3001			TURKEY: Scheme of General Ignatiew and reform of the Porte. 	6 Dec 1876	18761206	18761206		6 pp.	O	N	30	7839535	6
fo 881/3002			TURKEY: Peace negociations. Proposed arrangements for Bulgarian villages. 	17 Dec 1876	18761217	18761217		2 pp.	O	N	30	7839536	6
fo 881/3003			PERSIA &amp; TURKEY: Memo. Persecution of Nestorian Christians by Turks, Persians, and Khoordish Tribes. (Mr. E. Hertslet) 	Dec 2 1876	18761202	18761202		Bound: Mema.	O	N	30	4531583	6
fo 881/3004			PACIFIC ISLANDS: Corres. Outrages on White Men by Natives 	Dec. 1875	18751201	18751231		Bound: Pacific 9.	O	N	30	4531351	6
fo 881/3004X			PACIFIC ISLANDS: Corres. and Memo. Annexation of New Guinea. Missing at transfer 	1875-1876	18750101	18761231			O	N	30	4531344	6
fo 881/3005			TURKEY: Alleged preparation by Turkey for war with Russia 	Dec 19 1876	18761219	18761219			O	N	30	7839537	6
fo 881/3006			TURKEY: Position of Christians in relation to Musselmens in militia. Frontier arrangements 	Dec 21 1876	18761221	18761221		2 pp.	O	N	30	7839538	6
fo 881/3007			TURKEY: Negociations to prepare an armistice between Russia and Turkey  	Dec 22 1876	18761222	18761222		2 pp.	O	N	30	7839539	6
fo 881/3008			Foreign Office: Confidential Print (numerical series). Missing at transfer  		0	0			O	N	30	7839540	6
fo 881/3009			TURKEY: The Marquis of Salisbury to the Earl of Derby on the Russo-Turkish war. Interview with Sultan. 	Dec 27 1876	18761227	18761227		1 pp.	O	N	30	7839541	6
fo 881/3010			FRANCE: Minutes of meeting between Mr Kennedy and M Gavard to discuss matters concerned with the commercial relations between Great Britain and France 	21 Dec 1876	18761221	18761221		2 pp.	O	N	30	7839542	6
fo 881/3011			FRANCE: Corres. Proposed new Commercial Treaty with France and Commercial Arrangements between European Powers 	1875-1876	18750101	18761231		Bound: France 18.	O	N	30	4528234	6
fo 881/3012			AUSTRIA-HUNGARY: Notice. Customs Duties on Cotton and Woollen Goods 	Nov. 24, 1876	18761124	18761124		Bound: Austria 9.	O	N	30	4525715	6
fo 881/3013			RUSSIA &amp; TURKEY: Hesitation of Sultan to accept Conference proposals. Threat of renewed war with Servia and  Montenegro 	Dec 28 1976	19761228	19761228		2 pp.	O	N	30	7843315	6
fo 881/3014			TURKEY: Telegram from the Marquis of Salisbury relating to General Ignatiew's wish for a formal record of proceedings. Also projects for Bosnia &amp; Herzegovina. 	Dec 28 1876	18761228	18761228		1 pp.	O	N	30	7843337	6
fo 881/3015			EGYPT: Further Corres. Judicial Reforms. R�glement. Part 2. Missing at transfer. See FO 407/6 	1874 June -1876 June	18740601	18760630		Bound: Egypt 4	O	N	30	4527457	6
fo 881/3016			TURKEY: To the Marquis of Salisbury. Objections to any protocols being signed not agreed to by several governments. 	Dec 29 1876	18761229	18761229		1 pp.	O	N	30	7843338	6
fo 881/3017			TURKEY: Telegram from the Marquis of Salisbury. Meeting of the Conference. Armistice for two months proposed. Turks object to the proposals of the Six Powers. 	Dec 29 1876	18761229	18761229		1 pp.	O	N	30	7843339	6
fo 881/3018			TURKEY: From the Marquis of Salisbury. Believes Turkish government desirous of compromise. Russians not prepared for war. Belgian scheme may be given up. 	Dec 30 1976	19761230	19761230		1 pp.	O	N	30	7843340	6
fo 881/3019			TURKEY: Correspondence with the Marquis of Salisbury. Meeting of the 3rd Conference. Act proposed by Russia. List of proposals disapproved of by Four Powers. Agreement as to course. 	Dec 31 1876-11 Jan 1877	18761231	18770111		2 pp.	O	N	30	7843341	6
fo 881/3020			CHINA: Telegrams. Official Intercourse. Trade, &amp;c. (Sir T. Wade) 	Sept. 1876	18760901	18760930		Bound: China 9.	O	N	30	4526451	6
fo 881/3021			TURKEY:Correspondence respecting conference proposals  	Jan 1 1877	18770101	18770101		1 pp.	O	N	30	7843342	6
fo 881/3022			UNITED STATES:Correspondence respecting a new extradiction treaty and extradiction matters with United States 	1 Nov 1876	18761101	18761101		1 pp.	O	N	30	7843457	6
fo 881/3023			UNITED STATES: Present state of negociation respecting temporary arrangement 	21 Nov 1876	18761121	18761121		4 pp.	O	N	30	7843459	6
fo 881/3024			UNITED STATES: Memo. Proposed new extradiction treaty with the United States (Lord Tenterden) 	29 Dec 1876	18761229	18761229		7 pp.	O	N	30	7843460	6
fo 881/3025			TURKEY: Further Corres. Affairs of Turkey. Part 7 	Nov. 1876	18761101	18761130		Bound: Turkey 35.	O	N	30	4533332	6
fo 881/3026			AUSTRIA-HUNGARY: Table of duties levied in Austria-Hungary on cotton &#38; woollen goods under tariff in supplement to convention with Austria Dec 1869 no longer in force and under tariff.. Missing at transfer.  	6 Jan 1877	18770106	18770106			O	N	30	7839543	6
fo 881/3027			SERVIA &amp; TURKEY: Memo. Little Zvornik. (Mr. E. Hertslet) 	Dec 21 1876	18761221	18761221		Bound: Mema.	O	N	30	4532524	6
fo 881/3028			TURKEY: Memo. Disputes between Bulgarian and Greek Populations of Turkey in Europe as to Church Government. (Sir R. Dalyell) 	Jan. 15, 1875	18750115	18750115		Bound: Turkey 41.	O	N	30	4533338	6
fo 881/3029			AFRICA: Journal. Sir W. Hewett's Proceedings in River Niger 	1876	18760101	18761231		Bound: Portugal 8.	O	N	30	4524281	6
fo 881/3030			TURKEY: No 46 from the Marquis of Salisbury. Minutes of the proceedings 1 to 10 preliminary meetings of the plenipotentiaries with annexes. Bosnia. Law of Vilayeti. Bulgaria. Montenegro. 	22 Dec 1876	18761222	18761222		21 pp.	O	N	30	7843472	6
fo 881/3031			AFRICA: Letter. Disturbances in the Niger. (Sir W. Hewett) 	Oct. 30, 1876	18761030	18761030		Bound: Portugal 8.	O	N	30	4524282	6
fo 881/3032			TURKEY: Corres. Plague at Baghdad. Report of Surgeon-Major W. H. Colvill 	June to Sept. 1876	18760601	18760930		Bound: Turkey 36.	O	N	30	4533336	6
fo 881/3033			TURKEY &amp; EGYPT: Memo. Mixed courts in Egypt. On the pending conflict between the mixed courts &amp; the Khedive (FJ Reilly)  	8 Dec 1876	18761208	18761208		14 pp.	O	N	30	7843480	6
fo 881/3034			EGYPT: Statement. Suez Canal. Claim of H.M. Government to immediate Payment of Capital of their Shares drawn up for repayment 					Bound: Egypt 34.	O	N	30	4527458	6
fo 881/3035			CHINA: Hunan Outrage. Evidence relating to the murder of Mr Margery. Mr Grosvenor's Mission.  	3 Aug 1876	18760803	18760803		8 pp.	O	N	30	7843492	6
fo 881/3036			CHINA: Further correspondence relating to the Hunan Outrage. Protection of foreigners. 	2 Oct 1876	18761002	18761002			O	N	30	7843511	6
fo 881/3037			FRANCE: Desp. Account of Sittings of Conseil sup�rieur de l'Agriculture du Commerce et de l'Industrie. (Lord Lyons) 	Oct. 14, 1876	18761014	18761014		Bound: France 18.	O	N	30	4528235	6
fo 881/3038			ZANZIBAR: Report. Zanzibar Slave Trade. (Mr. Rothery) 	1876	18760101	18761231		Bound: Zanzibar 1.	O	N	30	4535324	6
fo 881/3039			UNITED STATES: Correspondence addressed to the Earl of Carnarvon on the subject of extradiction 	18 July 1876	18760718	18760718			O	N	30	7843517	6
fo 881/3040			EGYPT: Statement. Suez Canal Company. Claim of H.M. Government to be represented, and to Vote at General Meetings 	1876	18760101	18761231		Bound: Egypt 34.	O	N	30	4527460	6
fo 881/3041			TURKEY: Audience with Sultan. Acceptance of proposals of plenipotentiaries notified by Lord Salisbury 	11 Jan 1877	18770111	18770111			O	N	30	7843528	6
fo 881/3042			TURKEY: Telegram dispatches to Lord Salisbury. Conversation with German Ambassador as to modification of the proposals of the Powers to Turkey. Correspondence not to be presented in form of protocol. Turks not expected to yield- &amp; will resist guarantees. Relations between Austria Germany &amp; Russia. Resume of mimimum proposals accepted by Russian Government for presentation to Turkey. Refusal of Turkish plenipotentiary to modified proposals. Last appeal to be made. Support lent by German Delegate to support Austrian &amp; Russian ultimatum. 	Jan 10 - Jan 11 1877	18770110	18770111		3 pp.	O	N	30	7843529	6
fo 881/3043			TURKEY: Meetings of representatives. Communication of last proposals. End of the conference. 	12 Jan 1877	18770112	18770112		1 pp.	O	N	30	7843533	6
fo 881/3044			TURKEY: Modified proposals of the plenipotentiaries. HM Government not to threaten to pledge to enforce the proposals. Sultan objects to the guarantees as dishonourable 	Jan 1-Jan 15 1877	18770101	18770115		1 pp.	O	N	30	7843534	6
fo 881/3045			TURKEY: No 84 from Lord Salisbury. Opposition of Turkish plenipotentiary to proposals of the Powers in Conference. His observations on the character &amp; bearing of the propositions &amp; grounds on which they were adopted  	4 Jan 1877	18770104	18770104		4 pp.	O	N	30	7843565	6
fo 881/3046			TURKEY: Despatches of Consul Holmes to Sir H Elliott relative to statements of Canon Liddon &amp; Mr McColl on cases of impalement in Bosnia (sent to newspapers 19 Jan 1877) 	Nov 3 1876-Nov 3 1877	18761103	18771103		5 pp.	O	N	30	7843566	6
fo 881/3047			Foreign Office: Confidential Print (numerical series). Missing at transfer  		0	0			O	N	30	7841353	6
fo 881/3047X			TURKEY: Letter. Plague in Turkey and measures to be taken by Sanitary Commission at Constantinople. (Surgeon-Major W. H. Colvill) 	Dec 28 1876	18761228	18761228		2 pp. Bound: Turkey 36.	O	N	30	7843569	6
fo 881/3048			TURKEY: From Lord Salisbury. Minutes of 5, 6, 7, 8 &amp; 9 Meeting of the Plenipotentiaries (Preliminary) with annexes. Status of Montenegro, Bulgaria, Servia &amp; Herzegovina. 	23 Dec 1876	18761223	18761223		16 pp.	O	N	30	7843567	6
fo 881/3049			TURKEY: Suggestion by the Sultan for a formal protocol disclaiming interfearance with the authority of the Sultan. Russian Army 170,000 strong &amp; in position. Relations bettween Austria &amp; Russia 	15 Jan 1877	18770115	18770115		1 pp.	O	N	30	7843568	6
fo 881/3050			TURKEY: Modified proposals communicated to Turkish plenipotentiaries 	Jan 15 1877	18770115	18770115			O	N	30	7841357	6
fo 881/3051			PORTUGAL: Memo. Old Treaties of Alliance and Guarantee between Great Britain and Portugal. (Mr. E. Hertslet) 	Jan. 10, 1877	18770110	18770110		Bound: Mema.	O	N	30	4531955	6
fo 881/3052			TURKEY: Telegram dispatches to &amp; from Lord Salisbury. General Ignatiew proposes coercive measures. British policy declared to be the maintenance of the status quo. Meeting of ministers. Sultan decries arrangements. 	Jan 16-17 1877	18770101	18771231		1 pp.	O	N	30	7843570	6
fo 881/3053			GENERAL: Draft article applying commercial treaties to British &#38; foreign colonies. Missing at transfer 		0	0			O	N	30	7841354	6
fo 881/3054			TURKEY: Telegram from Lord Salisbury. Grand Council. Resolution to refuse guarantees. Three patriarchs invited, but three vicars sent instead. One dissentient voice in favour of peace-head of Protestant community. Ambassador will leave 22nd inst. Sultan willing to accept terms. Grand Vizier resists.  	18 Jan 1877	18770118	18770118		1 pp.	O	N	30	7843571	6
fo 881/3055			TURKEY: Conference proposals &amp; counter proposals. Local control of taxation and local militia. 	20 Jan 1877	18770120	18770120		1 pp.	O	N	30	7843572	6
fo 881/3056			TURKEY: Final Conference  21st inst. Last protocol signed with Austrian Ambassador.Failure of Ottoman Plenipotentiary to turn up.Publication of reduced proposals suggested. 	22 Jan 1877	18770122	18770122		1 pp.	O	N	30	7843573	6
fo 881/3057			GENERAL &amp; FRANCE &amp; MADAGASCAR: Correspondence Slave Trade between Madagascar, Mozambique, and R�union 	1875-1876	18750101	18761231		Bound: Madagascar 1.	O	N	30	4528979	6
fo 881/3058			ABYSSINIA &amp; EGYPT: Corres. Invasion of Abyssinia by Egyptian Troops 	1875-1876	18750101	18761231		Bound: Abyssinia 5.	O	N	30	4524150	6
fo 881/3059			RUSSIA: Views of Russian Government on subject of Central Asia 	5 April 1875	18750405	18750405		15 pp.	O	N	30	7843574	6
fo 881/3060			TURKEY: Corres. Mixed Marriages in Turkey 	1874-1876	18740101	18761231		Bound: Turkey 26.	O	N	30	4533343	6
fo 881/3061			PERSIA: Corres. Protection to Persons of Persian Origin born in India 	1876	18760101	18761231		Bound: Persia 6.	O	N	30	4531585	6
fo 881/3062			EGYPT: Memo. Red Sea Quarantine. (Mr. G. B. Wylde) 	Jan 28 1877	18770128	18770128		Bound: Mema.	O	N	30	7843521	6
fo 881/3063			PERSIA: Further Corres. Consular Jurisdiction 	1874-1876	18740101	18761231		Bound: Persia 8.	O	N	30	4531584	6
fo 881/3064			AUSTRIA-HUNGARY: Corres. Commercial Negotiations 	1874-1877	18740101	18771231		Bound: Austria 9.	O	N	30	4525716	6
fo 881/3065			TURKEY: Memo. Circassian Emigrants in Turkey. (Mr. E. Hertslet) 	Jan. 23, 1877	18770123	18770123		Bound: Mema.	O	N	30	4533340	6
fo 881/3066			TURKEY: Account. Events since the Berlin Memo., and Policy pursued by Lord Derby on Eastern Question. Letter of Duke of Argyll, &amp;c. (Mr. T. H. Sanderson) 	Jan. 25, 1877	18770125	18770125		Bound: Turkey 41.	O	N	30	4533339	6
fo 881/3067			GREECE: Memo. British Prince for Throne of Greece. Conference between Mr. Canning and Greek Deputies, 1825. (Prince Leopold) 	1877	18770101	18771231		Bound: Mema.	O	N	30	4530213	6
fo 881/3068			TURKEY: Analysis. Parliamentary Papers. Affairs of Turkey and Conference at Constantinople. (Turkey, Nos. 1 and 2.) (Lord Tenterden.) 	Feb. 7, 1877	18770207	18770207		Bound: Mema. See Nos. 2899, 3427	O	N	30	4533341	6
fo 881/3069			UNITED STATES: Corres. Extradition 	June to Dec. 1876	18760601	18761231		Bound: America 19.	O	N	30	4534782	6
fo 881/3069X			UNITED STATES: Draft. Extradition Treaty. Missing at transfer 	1872-1876	18720101	18761231			O	N	30	4534787	6
fo 881/3071			FRANCE: Desps. Emigration of Indian Coolies to French Colonies. R�union, &amp;c. (Duc Decazes) 	1877	18770101	18771231		Bound: France 13.	O	N	30	4528236	6
fo 881/3072			RUSSIA &amp; TURKEY: Memo. Claim of Russia to exercise Protectorate over Christian Subjects of the Porte previous to Treaty of 1856. (Mr. T. H. Sanderson) 	Feb 8 1877	18770208	18770208		Bound: Mema.	O	N	30	4532306	6
fo 881/3074			GENERAL: Regulations. Foreign Messenger Service 	Feb. 15, 1877	18770215	18770215		Bound: General 4.	O	N	30	4528978	6
fo 881/3075			FRANCE: Memo. Deputation from Tariff Committee of Yorkshire Chambers of Commerce 	Jan. 12, 1877	18770112	18770112		Bound: France 18.	O	N	30	4528237	6
