fo 881/4487			MONTENEGRO &amp; TURKEY: Corres. Rectification of Montenegrin Frontier 	Aug to Oct 1880	18800801	18801031		Bound: Montenegro 2.	O	N	30	4530945	6
fo 881/4488			UNITED STATES: Memo. Copyright with United States. (Mr. J. H. G. Bergne) 	Aug. 25, 1881	18810825	18810825		Bound: Mema.	O	N	30	4534823	6
fo 881/4489			EGYPT: Further Corres. Judicial Reforms. Part 4 	1879-1880	18790101	18801231		Bound: Egypt 4.	O	N	30	4527543	6
fo 881/4490			FRANCE: Minutes. Conferences. Renewal of Commercial Treaties 	1881	18810101	18811231		Bound: France 18.	O	N	30	4528295	6
fo 881/4490X			FRANCE: Minutes. Conferences. Renewal of Commercial Treaties. Missing at transfer 	1881	18810101	18811231		Bound: France 18	O	N	30	4528296	6
fo 881/4491			TURKEY: Report. Military. Missing at transfer 	Aug 22 1881	18810822	18810822		Bound: Turkey 44	O	N	30	4533784	6
fo 881/4492			"UNITED STATES: Mema. Seizure of ""Thomas Watson"" and ""Mary Varney"" for alleged violation of Laws of Slave Trade. Machado Claims. (Mr. A. Walmisley and Mr. W. H. Wylde) "	1880	18800101	18801231		Bound: Mema.	O	N	30	4534824	6
fo 881/4493			SPAIN: Corres. Importation of Madras Coolies into Cuba. Part 2 	Mar. to Nov. 1880	18800301	18801130		Bound: Spain 5.	O	N	30	4532828	6
fo 881/4493X			TURKEY: Report. Military. Missing at transfer 	Sept 5 1881	18810905	18810905		Bound: Turkey 44	O	N	30	4533785	6
fo 881/4494			FRANCE: Corres. Indian Coolie Emigration to R�union 	1879-1880	18790101	18801231		Bound: France 13.	O	N	30	4528298	6
fo 881/4495			AUSTRIA-HUNGARY &amp; TURKEY: Memo. Regulations for the Danube between Iron Gates and Galatz. (Mr. F.L. Bertie) 	Sept 7 1881	18810907	18810907		Bound: Mema.	O	N	30	4525755	6
fo 881/4496			PERSIA: Memo. Superintendence of British Mission and Consulates in Persia. Cost of Mission. (Mr. F. L. Bertie) 	Sept. 6, 1881	18810906	18810906		Bound: Mema.	O	N	30	4531609	6
fo 881/4497			TURKEY: O. in C. Slave Trade. (L.G., Sept. 2, 1881) 	Aug. 26, 1881	18810826	18810826		Bound: Turkey 57.	O	N	30	4533790	6
fo 881/4498			GENERAL: Corres. Slave Trade 	1880	18800101	18801231		Bound: General 16.	O	N	30	4529133	6
fo 881/4498X			GENERAL: Corres. Slave Trade. Mozambique 	Nov. 1880	18801101	18801130		Bound: General 16.	O	N	30	4529134	6
fo 881/4499			EGYPT: Letter. Slave Trade. Massowah as a Free Port. (Malcolm Pasha) 	Aug. 25, 1881	18810825	18810825		Bound: Egypt 22.	O	N	30	4527521	6
fo 881/4500			EGYPT: Report. Alexandria Harbour 	Aug. 1881	18810801	18810831		Bound: Egypt 10.	O	N	30	4527523	6
fo 881/4500X			EGYPT: Report. Alexandria Harbour 	Aug. 1881	18810801	18810831		Bound: Egypt 10.	O	N	30	4527524	6
fo 881/4501			EGYPT &amp; ITALY: Corres. Egypt and Italy. Assab Bay 	July 13 1881	18810713	18810713		Bound: Italy 8. Bound: Egypt 12.	O	N	30	4527525	6
fo 881/4502			TURKEY: Report. Military. Missing at transfer 	1881	18810101	18811231			O	N	30	4533762	6
fo 881/4503			EGYPT: Memo. Events in Egypt since Deposition of late Khedive leading to Military Insurrection. (Mr. P. Currie) 	Sept. 17, 1881	18810917	18810917		Bound: Mema.	O	N	30	4527526	6
fo 881/4504			GENERAL: Draft. Slave Trade Declaration. Alteration in Instructions 	1881	18810101	18811231		Bound: Slave Trade 1.	O	N	30	4529135	6
fo 881/4505			TURKEY: Report. Military. Missing at transfer 	Sept 12 1881	18810912	18810912		Bound: Turkey 44	O	N	30	4533786	6
fo 881/4506			PORTUGAL: Corres. Negotiation of Treaty for Suppression of Slave Trade on S.E. Coast of Africa, and for Co-operation in work of South African Civilization. Part 3 	1881	18810101	18811231		Bound: Portugal 11.	O	N	30	4531970	6
fo 881/4507			"GENERAL: Memo. ""Parlement Belge."" Foreign Ships carrying Mails. (Mr. F. S. Reilly) "	July 5, 1881	18810705	18810705		Bound: General 21.	O	N	30	4529137	6
fo 881/4508			NICARAGUA: Memo. Mosquito Arbitration. (Mr. Reilly) 	July 28 1879	18790728	18790728		Bound: Nicaragua 1. 	O	N	30	4531292	6
fo 881/4509			EGYPT: Memo. History of Administration of Egypt, 1840-1881. (Lord Tenterden) 	Oct. 10, 1881	18811010	18811010		Bound: Mema.	O	N	30	4527522	6
fo 881/4510			PERSIA &amp; RUSSIA: Memo. Russian Advance on Persian Frontier. (Lord Tenterden) 	Oct 11 1881	18811011	18811011		Bound: Mema.	O	N	30	4531610	6
fo 881/4510X			TURKEY: Report. Military. Missing at transfer 	Sept 27 1881	18810927	18810927		Bound: Turkey 44	O	N	30	4533787	6
fo 881/4511			TURKEY: Further Corres. Danube Navigation. Execution of Treaty of Berlin. Part 3 	Aug. 1880 to June 1881	18800801	18810630		Bound: Turkey 28.	O	N	30	4533780	6
fo 881/4512			GREECE: Further Corres. Affairs of Greece. 	June 1881	18810601	18810630		Bound: Greece 13. For previous Papers, see AFFAIRS OF TURKEY	O	N	30	4530249	6
fo 881/4513			MOROCCO: Desp. Agricultural Taxes. New Tariff. Complaints of Foreigners. Collective Note. (Sir J. Drummond Hay) 	Sept. 17, 1881	18810917	18810917		Bound: Morocco 5.	O	N	30	4530973	6
fo 881/4514			FRANCE: Propositions. French Tariff. Droits sur la Coutellerie 	1881	18810101	18811231		Bound: France 20.	O	N	30	4528297	6
fo 881/4514X			TURKEY: Note. Delimitation Commissions under Treaty of Berlin. Note to Signatory Powers of Treaty, sanctioning Acts of, on part of H.M. Government. (Spare Lithographed Copies, with Printed Modifications to Bulgarian Boundary Act of Dec. 17, 1878, and Map). Missing at transfer 	1880 Aug 9	18800809	18800809		Bound: Turkey 57	O	N	30	4533779	6
fo 881/4515			TRIPOLI &#38;TURKEY: Military Report. Fortifications and Number of Troops. Sketch of Tripoli (Major Swaine). Bound: Turkey 44. Missing at transfer 	1881	18810101	18811231			O	N	30	4533008	6
fo 881/4516			TURKEY: Report. Military 	Oct 12 1881	18811012	18811012		Bound: Turkey 44.	O	N	30	4533761	6
fo 881/4517			UNITED STATES: Further Corres. Fortune Bay, Newfoundland 	1880-1881	18800101	18811231		Bound: America 20.	O	N	30	4534812	6
fo 881/4520X			CHINA &amp; JAPAN: O. in C. Consular Jurisdiction. (L.G., Oct. 28, 1881) 	Oct 25 1881	18811025	18811025			O	N	30	4526492	6
fo 881/4521			CHINA &amp; RUSSIA:  Corres. Russo-Chinese Treaty. Kuldja Territory. Part 1 	1878-1880	18780101	18801231		Bound: China 16.	O	N	30	4526493	6
fo 881/4522			TURKEY: Report. Military. Missing at transfer 	Oct 1881	18811001	18811031		Bound: Turkey 44	O	N	30	4533788	6
fo 881/4523			GREECE: Further Corres. Affairs of Greece. 	July 1881	18810701	18810731		Bound: Greece 13. For previous Papers, see AFFAIRS OF TURKEY	O	N	30	4530250	6
fo 881/4523X			BORNEO: Papers. North Borneo Company 	1878-1882	18780101	18821231		Bound: Borneo 4.	O	N	30	4525973	6
fo 881/4524			DENMARK: O. in C. Seamen Deserters. (L.G., July 26, 1881). Missing at transfer 	July 15 1881	18810715	18810715			O	N	30	4527337	6
fo 881/4525			JAPAN: Tariff. Comparison 	1881	18810101	18811231		Bound: Japan 3.	O	N	30	4530660	6
fo 881/4526			TURKEY: Reports. Military. Missing at transfer 	Oct 1881	18811001	18811031		Bound: Turkey 44	O	N	30	4533789	6
fo 881/4527			BRAZIL: Papers. Anglo-Brazilian Claims. Part 1 	1866	18660101	18661231		Bound: Brazil 3. In 2 parts.	O	N	30	4526072	6
fo 881/4527X			BRAZIL: Memo. Anglo-Brazilian Claims. (Baron Cabo Frio). Missing at transfer  	1880 Feb 14	18800214	18800214		Bound: Brazil 3.	O	N	30	4526075	6
fo 881/4528			BORNEO: Charter. British North Borneo Company. (L.G., Nov. 8, 1881) 	Nov. 1, 1881	18811101	18811101			O	N	30	4525971	6
fo 881/4528X			BORNEO: Translations. Title Deeds of Territory granted to Dent and Overbeck. Bound: Borneo 4. Missing at transfer  	1877-1878	18770101	18781231			O	N	30	4525972	6
fo 881/4529			JAPAN: Further Corres. Treaty Revision. Part 4 	Jan. to Sept. 1881	18810101	18810930		Bound: Japan 3.	O	N	30	4530661	6
fo 881/4530			CHINA: Further Corres. Chefoo Convention 	1878-1881	18780101	18811231		Bound: China 12.	O	N	30	4526496	6
fo 881/4531			ITALY: Draft. Convention. Assab Bay 	1881	18810101	18811231		Bound: Egypt 12.	O	N	30	4530492	6
fo 881/4532			TURKEY: Further Corres. Affairs of Turkey. Part 60 	April 1881	18810401	18810430		Bound: Turkey 35.	O	N	30	4533794	6
fo 881/4533			TURKEY: Further Corres. Affairs of Turkey. Part 61 	May 1881	18810501	18810531		Bound: Turkey 35.	O	N	30	4533795	6
fo 881/4533X			EQUATOR: Treaty. Commerce, &amp;c. 	Oct. 18, 1880	18801018	18801018		Bound: Equator 1.	O	N	30	4528017	6
fo 881/4534			GREECE: Further Corres. Affairs of Greece. 	Oct. 1881	18811001	18811031		Bound: Greece 13. For previous Papers, see AFFAIRS OF TURKEY	O	N	30	4530253	6
fo 881/4535			TURKEY: Further Corres. Affairs of Turkey. Part 63 	July 1881	18810701	18810731		Bound: Turkey 35.	O	N	30	4533797	6
fo 881/4536			GREECE: Further Corres. Affairs of Greece. 	Aug. 1881	18810801	18810831		Bound: Greece 13. For previous Papers, see AFFAIRS OF TURKEY	O	N	30	4530251	6
fo 881/4537			SIAM: Memo. Kraw Canal. (Mr. A. Walmisley) 	Oct 17 1881	18811017	18811017		Bound: Mema.	O	N	30	4532556	6
fo 881/4537X			SIAM: Draft. India and Siam. Treaty 	1881	18810101	18811231		Bound: Siam 2.	O	N	30	4532557	6
fo 881/4538			TURKEY: Letter. Slave Trade with Egypt. Observations on Convention of Jan. 25, 1880, and Memo. (Capt. G. Malcolm) 	Oct. 29, 1881	18811029	18811029		Bound: Egypt 22.	O	N	30	4533791	6
fo 881/4539			GENERAL: Reports. Law Officers 	1880	18800101	18801231		Bound: L.O.R.	O	N	30	4529138	6
fo 881/4540			TURKEY: Further Corres. Affairs of Turkey. Part 64 	Aug. 1881	18810801	18810831		Bound: Turkey 35.	O	N	30	4533798	6
fo 881/4541			TURKEY: Further Corres. Affairs of Turkey. Part 65 	Sept. 1881	18810901	18810930		Bound: Turkey 35.	O	N	30	4533799	6
fo 881/4542			BELGIUM: Further Corres. Immoral Traffic in English Girls 	Feb. to June 1881	18810201	18810630		Bound: Belgium 2.	O	N	30	4525842	6
fo 881/4543			GENERAL: Corres. Collisions at Sea. Establishment of International Tribunals for Trial of Cases 	1878-1881	18780101	18811231		Bound: General 1.	O	N	30	4529140	6
fo 881/4544			ARGENTINE REPUBLIC &amp; CHILE: Despatch as to the boundary question between Chile &amp; the Argentine Confederation relative to the ownership of the Straits of Magellan and memo of Sir E Herslet on the subject 	Feb & July 1881	18810201	18810731		Bound: Argentine 1.	O	N	30	4525388	6
fo 881/4545			CHINA: Papers. Proposed O. in C. for Registration of Public Companies in China 	1881	18810101	18811231		Bound: China 6.	O	N	30	4526497	6
fo 881/4546			TURKEY: Draft. Convention. Railways in Turkey in Europe 	1881	18810101	18811231		Bound: Turkey 51.	O	N	30	4533792	6
fo 881/4547			"SPAIN: Memo. SS. ""Gunga."" (Mr. W. C. Phillips) "	Aug. 1881	18810801	18810831		Bound: Mema.	O	N	30	4532834	6
fo 881/4548			"SPAIN: Desp. Seizure of Opium on SS. ""Gunga"" at Manila "	Jan. 6, 1881	18810106	18810106		Bound: Spain 10.	O	N	30	4532835	6
fo 881/4548X			ASIA: Paper. Anglo-Afghan War. [5th Section.] (W.O.) 	1879-1880	18790101	18801231		Bound: General 20.	O	N	30	4525454	6
fo 881/4549			GREECE: Further Corres. Affairs of Greece. 	Sept. 1881	18810901	18810930		Bound: Greece 13. For previous Papers, see AFFAIRS OF TURKEY	O	N	30	4530252	6
fo 881/4550			ASIA &amp; RUSSIA: Further Corres. Affairs in Asia 	Jan to June 1881	18810101	18810630		Bound: Russia 9.	O	N	30	4525456	6
fo 881/4551			GENERAL: Mema., &amp;c. Relief of Distressed British Subjects 	1880-1881	18800101	18811231		Bound: General 85.	O	N	30	4529141	6
fo 881/4552			TURKEY: Further Corres. Turkish Regulations for Pilgrim Traffic 	Oct 11 1877 to Sept 1880	18771011	18800930		Bound: Turkey 36.	O	N	30	4533793	6
fo 881/4553			GENERAL: List. Treaties of Commerce. Most Favoured Nation 	July 31 1879	18790731	18790731			O	N	30	4529139	6
fo 881/4554			MEXICO: Memo. Support to Claims of British Subjects. (Sir E. Hertslet) 	Nov. 5, 1881	18811105	18811105		Bound: Mema.	O	N	30	4530897	6
fo 881/4555			UNITED STATES: Views respecting the status of the Panama Canal &amp; interpretation of articles in the Clayton Bulwer Treaty  	19 Nov 1881	18811119	18811119		See PRO 30/29/279	O	N	30	7866933	6
fo 881/4555X			HAYTI [HAITI]: Notice. Haytian Decree. Port of J�r�mie in a state of Blockade. (L.G., July 20, 1883) 	July 20, 1883	18830720	18830720			O	N	30	4530351	6
fo 881/4556			TURKEY: Further Corres. Affairs of Turkey. Part 62 	June 1881	18810601	18810630		Bound: Turkey 35.	O	N	30	4533796	6
fo 881/4557			GENERAL: Memo. Most-favoured-Nation Article in Commercial Treaties. (Mr. C. M. Kennedy) 	Nov. 25, 1881	18811125	18811125		Bound: Mema.	O	N	30	4529142	6
fo 881/4557X			PORTUGAL: Decree. Decima Industrial Tax 	June 5, 1844	18440605	18440605		Bound: Portugal 23.	O	N	30	4531974	6
fo 881/4558			"PORTUGAL: Memo. Payment of ""Decima Industrial"" Tax by British Subjects. (Sir E. Hertslet) "	Dec. 16, 1881	18811216	18811216		Bound: Mema.	O	N	30	4531973	6
fo 881/4559			TURKEY: Report. Military 	Dec 13 1881	18811213	18811213		Bound: Turkey 44.	O	N	30	4533804	6
fo 881/4559X			PORTUGAL: Law. Decima Industrial Tax 	May 30, 1860	18600530	18600530		Bound: Portugal 23.	O	N	30	4531975	6
fo 881/4560			MOROCCO: Regulations. Agrarian Tax and Gate Tax 	Mar. 30, 1881	18810330	18810330		Bound: Morocco 5.	O	N	30	4530974	6
fo 881/4560X			ITALY: Notice. Commercial Treaty prolonged. (L.G., Dec. 9, 1881) 	Dec. 7, 1881	18811207	18811207			O	N	30	4530493	6
fo 881/4561			UNITED STATES: Letter from Mr Blaine to Mr Lowell relating to the proposed modification of the Clayton Bulwer Treaty with respect to the Panama Canal. Missing at transfer. See PRO 30/29/279  	29 Nov 1881	18811129	18811129			O	N	30	7866935	6
fo 881/4562			TURKEY: Further Corres. Administrative Reforms in Asiatic Provinces of Turkey. Part 4 	Jan. to June 1881	18810101	18810630		Bound: Turkey 55.	O	N	30	4533815	6
fo 881/4563			TURKEY: Further Corres. Affairs of Turkey. Part 66 	Oct. 1881	18811001	18811031		Bound: Turkey 35.	O	N	30	4533800	6
fo 881/4564			GREECE: Further Corres. Affairs of Greece. 	Nov. 1881	18811101	18811130		Bound: Greece 13. For previous Papers, see AFFAIRS OF TURKEY	O	N	30	4530254	6
fo 881/4565			CHINA: Further Corres. Anti-Missionary Riots at Foochow 	1880	18800101	18801231		Bound: China 15.	O	N	30	4526498	6
fo 881/4566			VENEZUELA: Memo. Boundary between British Guiana and Venezuela. (Lieut.-Governor Young and Mr. Haynes Smith) 	1881	18810101	18811231		Bound: Mema.	O	N	30	4535164	6
fo 881/4567			SIAM: Report. Administration of Kingdom of Siam. (Consul-General W. Gifford Palgrave) 	30 July 1881	18810730	18810730		Bound: Siam 2.	O	N	30	4532555	6
fo 881/4568			TUNIS: Corres. Affairs of North Africa. Part 1 	Mar. to June 1881	18810301	18810630		Bound: Africa 14.	O	N	30	4533039	6
fo 881/4568X			CENTRAL AMERICA: Draft. Convention with Salvador. Copy right 	July 1881	18810701	18810731		Bound: General 18.	O	N	30	4526180	6
fo 881/4569			CENTRAL AMERICA &amp; UNITED STATES: Further Memo. Clayton-Bulwer Treaty. Proposed Abrogation. With reference to Mr. Blaine's Statements in Note to Mr. Lowell of Nov. 29, 1881. (Sir E. Hertslet) 	Dec 30 1881	18811230	18811230		Bound: Mema.	O	N	30	4526181	6
fo 881/4570			TURKEY: Report. Military 	Dec. 24, 1881	18811224	18811224		Bound: Turkey 44.	O	N	30	4533803	6
fo 881/4570X			GENERAL: O. in C. Collisions at Sea. (L.G., Sept. 2, 1881) 	Aug. 26, 1881	18810826	18810826			O	N	30	4529143	6
fo 881/4571			TURKEY: Reports. Military 	1881	18810101	18811231		Bound: Turkey 44.	O	N	30	4533805	6
fo 881/4571X			GENERAL: Os. in C. Contagious Diseases (Animals) 	1881	18810101	18811231			O	N	30	4529144	6
fo 881/4572			FRANCE &amp; GENERAL: Corres. Monetary Conference at Paris 	1881	18810101	18811231		Bound: France 4.	O	N	30	4528299	6
fo 881/4572X			GENERAL: O. in C. Collisions at Sea 	Nov 27 1880	18801127	18801127			O	N	30	4529145	6
fo 881/4573			HAYTI [HAITI] &#38; UNITED STATES: Memo. American Designs on Bay of Samana. (Sir E. Hertslet) 	Dec 27 1881	18811227	18811227		Bound: Mema.	O	N	30	4530347	6
fo 881/4574			COLOMBIA &#38; NICARAGUA (NEW GRANADA &#38; CENTRAL AMERICA) &#38; UNITED STATES: Correspondence respecting the construction of a Canal across the Isthmus of Panama. Missing at transfer  	1880-1881	18800101	18811231		Bound: Colombia 1	O	N	30	4527101	6
fo 881/4575			NICARAGUA &amp; UNITED STATES: Corres. Interoceanic Canal across Nicaragua. Negotiations between Mr. Fish and Dr. Cardenas for Convention 	1876-1877	18760101	18771231		Bound: Colombia 1.	O	N	30	4531293	6
fo 881/4576			PERSIA &amp; RUSSIA &amp; TURKEY: Further Corres. Demarcation of Russo-Turkish Frontier in Asia. (Khotour Protocol) 	1880-1881	18800101	18811231		Bound: Turkey 54.	O	N	30	4531612	6
fo 881/4576X			PERSIA &amp; TURKEY: Protocol. Kotour Boundary. (Signed by British and Russian Commissioners) 	July 27 1880	18800727	18800727			O	N	30	4531615	6
fo 881/4577			TURKEY: Report. Military 	Jan. 9, 1882	18820109	18820109		Bound: Turkey 44.	O	N	30	4533806	6
fo 881/4577X			GERMANY: Desp. Incorporation of Hamburg into the Customs Union of Germany (Zollverein). (L.G., Feb. 3, 1882) 	Feb. 2, 1882	18820202	18820202		Bound: Germany 1.	O	N	30	4529977	6
fo 881/4578			GENERAL: Memo. Right of British Colonies to enter into separate arrangements with with Foreign Countries. (Sir E. Hertslet) 	Jan. 7, 1882	18820107	18820107		Bound: Mema.	O	N	30	4529146	6
fo 881/4579			HAYTI [HAITI] &#38; UNITED STATES: Memo. Right of Sovereignty over Island of Navassa. (Sir E. Hertslet) 	Jan 4 1882	18820104	18820104		Bound: Mema.	O	N	30	4530348	6
fo 881/4580			EGYPT: Corres. Affairs of Egypt. Part 1 	1881	18810101	18811231		Bound: Egypt 14.	O	N	30	4527529	6
fo 881/4581			TURKEY: Memo. Right of Turkish Authorities at Candia to demand 8 per cent. on goods exported from Crete to Varna. (Sir E. Hertslet). Missing at transfer  	1881 Oct 27	18811027	18811027		Bound: Mema	O	N	30	4533816	6
fo 881/4582			TURKEY: Report. Military 	Jan. 1882	18820101	18820131		Bound: Turkey 44.	O	N	30	4533807	6
fo 881/4583			GREECE: Further Corres. Affairs of Greece. 	Dec. 1881	18811201	18811231		Bound: Greece 13. For previous Papers, see AFFAIRS OF TURKEY	O	N	30	4530255	6
fo 881/4584			EGYPT: Reports. Slave Trade in Red Sea. (Morice Bey) 	1877	18770101	18771231		Bound: Slave Trade 1.	O	N	30	4527530	6
fo 881/4585			AUSTRIA-HUNGARY: Memo. Austro-Hungarian Bill. Revision of the Tariff 	Feb. 28, 1882	18820228	18820228		Bound: Austria 11.	O	N	30	4525756	6
fo 881/4586			EGYPT: Decrees. Boards of Health at Cairo and Alexandria 	1881	18810101	18811231		Bound: Egypt 11.	O	N	30	4527531	6
fo 881/4588			CHINA: Reports. Trade at Treaty Ports 	1880	18800101	18801231		Bound: China 19.	O	N	30	4526502	6
fo 881/4589			EGYPT: Memo. Islands of Sebah or Jezirat Sab h (or 7 Brothers). With Map. (Sir E. Hertslet) 	Feb. 22, 1882	18820222	18820222		Bound: Mema.	O	N	30	4527527	6
fo 881/4590			EGYPT &amp; FRANCE &amp; ITALY: Memo. French and Italian Designs in Red Sea and its neighbourhood. With Map. (Sir E. Hertslet) 	Mar 4 1882	18820304	18820304		Bound: Mema.	O	N	30	4527533	6
fo 881/4591			NETHERLANDS: List. Treaties between the Dutch and Native Princes in Eastern Seas. 	1843-1883	18430101	18831231		Bound: Netherlands 1. See No. 6355	O	N	30	4531203	6
fo 881/4591X			ZANZIBAR: O. in C. Application of Indian Penal Code 	Feb. 27, 1882	18820227	18820227			O	N	30	4535331	6
fo 881/4592			EGYPT: Memo. Neutralization of Suez Canal. (Sir E. Hertslet) 	Feb. 26, 1882	18820226	18820226		Bound: Mema.	O	N	30	4527528	6
fo 881/4593			TURKEY: Further Corres. Affairs of Turkey. Part 67 	Nov. 1881	18811101	18811130		Bound: Turkey 35.	O	N	30	4533801	6
fo 881/4594			TURKEY: Further Corres. Affairs of Turkey. Part 68 	Dec. 1881	18811201	18811231		Bound: Turkey 35.	O	N	30	4533802	6
fo 881/4595			CHINA &amp; RUSSIA: Corres. Russo-Chinese Treaty. Kuldja Territory. Part 2 	1881	18810101	18811231		Bound: China 16.	O	N	30	4526494	6
fo 881/4595X			CHINA: Correspondence relating to travels in the interior of China. Missing at transfer  	1882	18820101	18821231		Printed Library	O	N	30	7866938	6
fo 881/4596			TURKEY: Further Corres. Danube Navigation. Execution of Treaty of Berlin. Part 4 	July to Dec. 1881	18810701	18811231		Bound: Turkey 28.	O	N	30	4533817	6
fo 881/4597			TURKEY: Report. Military. Missing at transfer 	Mar 7 1882	18820307	18820307		Bound: Turkey 44	O	N	30	4533808	6
fo 881/4598			GENERAL: Corres., Charter, &amp;c. New Zealand Co. 	1840-1841	18400101	18411231		Bound: General 84.	O	N	30	4529147	6
fo 881/4599			BORNEO: Memo. North Borneo Charter. (Sir J. Pauncefote) 	Jan. 1882	18820101	18820131		Bound: Mema.	O	N	30	4525974	6
fo 881/4600X			EGYPT: Proclamation. Arabi Pasha, a Rebel 	1882	18820101	18821231		Bound: Egypt 42.	O	N	30	4527532	6
fo 881/4601			FRANCE: Memo. Channel Tunnel. (Sir E. Hertslet) 	Mar. 13, 1882	18820313	18820313		Bound: Mema.	O	N	30	4528300	6
fo 881/4601X			ABYSSINIA: Letter from King John of Abyssinia to the Queen. Missing at transfer 		0	0			O	N	30	7866942	6
fo 881/4602			CHILE &amp; PERU: Further Corres. Conduct of War against Peru by Chile 	1879-1881	18790101	18811231		Bound: Chile 1.	O	N	30	4526207	6
fo 881/4603			GENERAL: Memo. Rights of Belligerent Ships in Neutral Ports. (Sir E. Hertslet) 	Jan. 30, 1882	18820130	18820130		Bound: Mema.	O	N	30	4529148	6
fo 881/4604			TURKEY: Memo. Razing of Bulgarian Fortresses. Articles XI and LII of Treaty of Berlin. (Mr. F. L. Bertie) 	Mar. 18, 1882	18820318	18820318		Bound: Mema.	O	N	30	4533818	6
fo 881/4605			TURKEY: Corres. Smyrna Quay Dues 	1868-1882	18680101	18821231		Bound: Turkey 27.	O	N	30	4533820	6
fo 881/4606			BRAZIL: Memo. British Claims on Brazilian Government. (Sir E. Hertslet) 	Mar. 29, 1882	18820329	18820329		Bound: Mema.	O	N	30	4526076	6
fo 881/4607			TURKEY: Corres. Finances of Turkey. Part 1 	1880-1881	18800101	18811231		Bound: Turkey 11.	O	N	30	4533821	6
fo 881/4608			GENERAL &amp; SPAIN: Memo. Lord Carnarvon's Draft Gibraltar Ordinance (1877) for Prevention of Smuggling. (Sir E. Hertslet) 	Mar 28 1882	18820328	18820328		Bound: Mema.	O	N	30	4529149	6
fo 881/4609			TURKEY: Desp. Military 	April 2, 1882	18820402	18820402		Bound: Turkey 44.	O	N	30	4533809	6
fo 881/4610			ARGENTINE REPUBLIC &amp; CHILE: Memo. Difference between Neutralization and Free Navigation of Straits of Magellan. (Sir E. Hertslet) 	April 6 1882	18820406	18820406		Bound: Mema.	O	N	30	4525389	6
fo 881/4610X			GENERAL: Desp. Slave Trade on Coast of Mozambique 	Oct. 10, 1881	18811010	18811010		Bound: Slave Trade 1.	O	N	30	4529154	6
fo 881/4611			MEXICO: Observations. Question of a Renewal of Relations with Mexico and its connection with obligation of Republic to recognize Claims of British Creditors. (Sir J. Walsham) 	Nov. 15, 1881	18811115	18811115		Bound: Mexico 3.	O	N	30	4530898	6
fo 881/4612			CHINA: Memo. Opium Question. (Sir J. Pauncefote) 	Mar 1 1882	18820301	18820301		Bound: Mema.	O	N	30	4526499	6
fo 881/4612X			CHINA: Paper. Trade and Manufacture of Opium. (I.O). Missing at transfer  	Mar 28 1882	18820328	18820328		Bound: China 6	O	N	30	4526501	6
fo 881/4613			BORNEO &amp; SPAIN: Minute. North Borneo Charter. Sir J. Pauncefote's Notes. (Sir C. Dilke) 	Jan 13 1882	18820113	18820113		Bound: Borneo 4.	O	N	30	4525975	6
fo 881/4614			BORNEO &amp; SPAIN: Memo. North Borneo Charter.Observations on points raised by Sir C. Dilke. Borneo Charter. (Sir J. Pauncefote) 	Jan 17 1882	18820117	18820117		Bound: Mema.	O	N	30	4525976	6
fo 881/4615			BORNEO &amp; SPAIN: Minute. North Borneo Charter. Observations on points raised by Sir C. Dilke. Borneo Charter. (Lord Granville) 	Jan 16 1882	18820116	18820116		Bound: Mema.	O	N	30	4525977	6
fo 881/4616			CHINA &amp; JAPAN: Corres., &amp;c. Draft Opium Regulations proposed by Japan. (Sir H. Parkes) 	1881	18810101	18811231		Bound: Japan 6.	O	N	30	4526500	6
fo 881/4617			TURKEY: Reports. Consular Establishments in Asia Minor and Syria, and Positions and future Employment of Assistants. (Sir C. Wilson and Mr. A. Nicolson) 	1881	18810101	18811231		Bound: Turkey 58.	O	N	30	4533819	6
fo 881/4619			EGYPT: Corres. Suppression of Slave Trade in Red Sea 	1882	18820101	18821231		Bound: Egypt 12.	O	N	30	4527534	6
fo 881/4620			TURKEY: Reports. Military 	April 1882	18820401	18820430		Bound: Turkey 44.	O	N	30	4533810	6
fo 881/4621			GENERAL: Corres. Most-favoured-Nation Article in Commercial Treaties 	1881-1882	18810101	18821231		Bound: General 84.	O	N	30	4529150	6
fo 881/4622			UNITED STATES: Corres. Imprisonment in Ireland of Naturalized Citizens of United States 	1881-1882	18810101	18821231		Bound: America 22.	O	N	30	4534825	6
fo 881/4623			TUNIS: Further Corres. Enfida Estate. Mr. Joseph Levy's claim to pre-emption, and dispatch of French Ship to Tunis. Part 2 	1881	18810101	18811231		Bound: Tunis 4.	O	N	30	4533036	6
fo 881/4624			GENERAL: Memo. Submarine Telegraph Cables. (Sir E. Hertslet) 	May 2, 1882	18820502	18820502		Bound: Mema.	O	N	30	4529151	6
fo 881/4625			TURKEY: Report. Military 	April 1882	18820401	18820430		Bound: Turkey 44.	O	N	30	4533811	6
fo 881/4625X			FRANCE: Minutes. French Commercial Negotiations. Deputations of Various Trades to Royal Commission. Minutes of Proceedings, 1 to 23 	May and June 1881	18810501	18810630		Bound: France 15.	O	N	30	4528301	6
fo 881/4626			GENERAL: Corres. Slave Trade 	1881	18810101	18811231		Bound: General 16.	O	N	30	4529152	6
fo 881/4627			EGYPT: Further Corres. Egyptian Jurisdiction over Somali Coast, &amp;c. Map 	1881	18810101	18811231		Bound: Egypt 6.	O	N	30	4527535	6
fo 881/4628			TURKEY: Further Corres. Administrative Reforms in Asiatic Provinces of Turkey. Part 5 	1881	18810101	18811231		Bound: Turkey 55.	O	N	30	4533825	6
fo 881/4629			TUNIS: Further Corres. Affairs of North Africa. Part 2 	July to Dec. 1881	18810701	18811231		Bound: Africa 14.	O	N	30	4533040	6
fo 881/4630			UNITED STATES: Correspondence relating to the imprisonment of American citizens in Ireland as suspects. Missing at transfer. See PRO 30/29/272  	28 April-18 May 1882	18820428	18820518			O	N	30	7866943	6
fo 881/4631			ASIA &amp; RUSSIA: Further Corres. Affairs of Asia 	July to Dec 1881	18810701	18811231		Bound: Russia 9.	O	N	30	4525457	6
fo 881/4632			FRANCE: Further Corres. Commercial Negotiations. Part 9 	1881-1882	18810101	18821231		Bound: France 18.	O	N	30	4528302	6
